Sheet: Sheet1
A1: AverageX_Test | B1: AverageY_Test
A2: 2285.452315 | B2: 968.73762950000003
A3: 2285.6153100000001 | B3: 968.70811079999999
A4: 2285.9025590000001 | B4: 968.8393671
A5: 2286.0340649999998 | B5: 968.93503090000002
A6: 2286.341766 | B6: 968.96431870000004
A7: 2286.4244880000001 | B7: 969.12633740000001
A8: 2286.6920789999999 | B8: 968.95176230000004
A9: 2286.755897 | B9: 969.17088920000003
A10: 2287.0854100000001 | B10: 969.08392130000004
A11: 2287.2322429999999 | B11: 969.03194559999997
A12: 2287.4551240000001 | B12: 969.19426150000004
A13: 2287.7214370000002 | B13: 969.09804599999995
A14: 2287.8596389999998 | B14: 969.39893229999996
A15: 2288.1790129999999 | B15: 969.35905460000004
A16: 2288.1898590000001 | B16: 969.37774730000001
A17: 2288.4418030000002 | B17: 969.53854309999997
A18: 2288.5316680000001 | B18: 969.61187719999998
A19: 2288.8908459999998 | B19: 969.84274040000003
A20: 2289.061162 | B20: 969.81917520000002
A21: 2289.2803650000001 | B21: 969.89651509999999
A22: 2289.4334600000002 | B22: 969.91789689999996
A23: 2289.6660750000001 | B23: 970.12333079999996
A24: 2289.864842 | B24: 970.23951350000004
A25: 2289.9815170000002 | B25: 970.28399979999995
A26: 2290.2341630000001 | B26: 970.46412610000004
A27: 2290.3315210000001 | B27: 970.69033420000005
A28: 2290.595566 | B28: 970.88127139999995
A29: 2290.6604149999998 | B29: 971.00845409999999
A30: 2290.8982860000001 | B30: 971.22679500000004
A31: 2290.9027409999999 | B31: 971.41734910000002
A32: 2291.1734259999998 | B32: 971.6094382
A33: =R[-1]C+0.3 -> 2291.473426 | B33: =((R[-1]C[8]-0.05)*(R[-1]C[-1]+0.3-R2C[-1]))+R2C -> 968.43657395000002
A34: =R[-1]C+0.3 -> 2291.7734260000002 | B34: =((R[-1]C[8]-0.05)*(R[-1]C[-1]+0.3-R2C[-1]))+R2C -> 968.42157395000004
A35: =R[-1]C+0.3 -> 2292.0734260000004 | B35: =((R[-1]C[8]-0.05)*(R[-1]C[-1]+0.3-R2C[-1]))+R2C -> 968.40657395000005
A36: =R[-1]C+0.3 -> 2292.3734260000006 | B36: =((R[-1]C[8]-0.05)*(R[-1]C[-1]+0.3-R2C[-1]))+R2C -> 968.39157394999995
A37: =R[-1]C+0.3 -> 2292.6734260000007 | B37: =((R[-1]C[8]-0.05)*(R[-1]C[-1]+0.3-R2C[-1]))+R2C -> 968.37657394999997
A38: =R[-1]C+0.3 -> 2292.9734260000009 | B38: =((R[-1]C[8])*(R[-1]C[-1]+0.3-R2C[-1]))+R2C -> 968.73762950000003
A39: =R[-1]C+0.3 -> 2293.2734260000011 | B39: =((R[-1]C[8])*(R[-1]C[-1]+0.3-R2C[-1]))+R2C -> 968.73762950000003
A40: =R[-1]C+0.3 -> 2293.5734260000013 | B40: =((R[-1]C[8])*(R[-1]C[-1]+0.3-R2C[-1]))+R2C -> 968.73762950000003
A41: =R[-1]C+0.3 -> 2293.8734260000015 | B41: =((R[-1]C[8])*(R[-1]C[-1]+0.3-R2C[-1]))+R2C -> 968.73762950000003
A42: =R[-1]C+0.3 -> 2294.1734260000017 | B42: =((R[-1]C[8])*(R[-1]C[-1]+0.3-R2C[-1]))+R2C -> 968.73762950000003
A43: =R[-1]C+0.3 -> 2294.4734260000018 | B43: =((R[-1]C[8])*(R[-1]C[-1]+0.3-R2C[-1]))+R2C -> 968.73762950000003
A44: =R[-1]C+0.3 -> 2294.773426000002 | B44: =((R[-1]C[8])*(R[-1]C[-1]+0.3-R2C[-1]))+R2C -> 968.73762950000003
A45: =R[-1]C+0.3 -> 2295.0734260000022 | B45: =((R[-1]C[8])*(R[-1]C[-1]+0.3-R2C[-1]))+R2C -> 968.73762950000003
A46: =R[-1]C+0.3 -> 2295.3734260000024 | B46: =((R[-1]C[8])*(R[-1]C[-1]+0.3-R2C[-1]))+R2C -> 968.73762950000003
A47: =R[-1]C+0.3 -> 2295.6734260000026 | B47: =((R[-1]C[8])*(R[-1]C[-1]+0.3-R2C[-1]))+R2C -> 968.73762950000003
A48: =R[-1]C+0.3 -> 2295.9734260000027 | B48: =((R[-1]C[8])*(R[-1]C[-1]+0.3-R2C[-1]))+R2C -> 968.73762950000003
A49: =R[-1]C+0.3 -> 2296.2734260000029 | B49: =((R[-1]C[8])*(R[-1]C[-1]+0.3-R2C[-1]))+R2C -> 968.73762950000003
A50: =R[-1]C+0.3 -> 2296.5734260000031 | B50: =((R[-1]C[8])*(R[-1]C[-1]+0.3-R2C[-1]))+R2C -> 968.73762950000003
A51: =R[-1]C+0.3 -> 2296.8734260000033 | B51: =((R[-1]C[8])*(R[-1]C[-1]+0.3-R2C[-1]))+R2C -> 968.73762950000003